<?xml version="1.0" encoding="UTF-8"?>
<realms xmlns:xsi="http://www.w3.org/2001/XMLSchema-instance" xsi:noNamespaceSchemaLocation="realm.xsd">
	<realm>
		<country>country0</country>
		<stype>0</stype>
		<org_name lang="en">org_name0</org_name>
		<address>
			<street>street0</street>
			<city>city0</city>
		</address>
		<contact>
			<name>name0</name>
			<email>email0</email>
			<phone>phone0</phone>
		</contact>
		<contact>
			<name>name1</name>
			<email>email1</email>
			<phone>phone1</phone>
		</contact>
		<contact>
			<name>name2</name>
			<email>email2</email>
			<phone>phone2</phone>
		</contact>
		<info_URL lang="en">http://www.eduroam.org/</info_URL>
		<policy_URL lang="en">http://www.eduroam.org/</policy_URL>
		<ts>2006-05-04T18:13:51.0Z</ts>
	</realm>
</realms>
